{
  "name": "Imperial",
  "description": "The Imperial faction has reigned for millennia. Their might is barely contested. Offend at your peril.",
  "colour": "b0c4de",
  "defaultDisposition": 50,
  "shipDesigns": [
    "core:imperialBig",
    "core:imperialCapital",
    "core:imperialMedium",
    "core:imperialSmall",
    "core:imperialTiny",
    "core:station"
  ]
}